{
    "$schema": "./schema/widget_response.json",
    "checked": false,
    "dimensions": {
        "width": 5,
        "height": 10
    },
    "id": 1,
    "name": "A green door",
    "price": 12.5,
    "tags": [
        "home",
        "green"
    ],
    "objects": [
        {
            "colour": "Red",
            "red": 255,
            "green": 0,
            "blue": 0
        },
        {
            "shape": "Square",
            "height": 100,
            "width": 100
        },
        {
            "colour": "Green",
            "red": 0,
            "green": 255,
            "blue": 0
        },
        {
            "shape": "Circle",
            "height": 10,
            "width": 10
        },
        {
            "$and": [
                {
                    "shape": "Square"
                },
                {
                    "colour": "Blue"
                }
            ]
        },
        {
            "$and": [
                {
                    "colour": "Orange"
                },
                {
                    "shape": "Triangle"
                }
            ]
        },
        {
            "$or": [
                {
                    "$and": [
                        {
                            "shape": "Square"
                        }
                    ]
                }
            ]
        },
        {
            "$and": [
                {
                    "colour": ""
                }
            ]
        }
    ]
}