{
    "$schema": "https://raw.githubusercontent.com/Outsmart-OOH/ooh_open_direct/master/demo/schema_example.json",
    "checked": false,
    "dimensions": {
        "width": 5,
        "height": 10
    },
    "id": 1,
    "name": "A green door",
    "price": 12.5,
    "tags": [
        "home",
        "green"
    ]
}